{
  "component": {
    "id": "subtypes@1.0.0",
    "name": "subtypes",
    "version": "1.0.0"
  },
  "kind": "lean-bridge-package-set-receipt",
  "packages": [
    {
      "artifacts": [
        {
          "bytes": 51362388,
          "path": "archives/LeanBridge-Runtime-0.0020546188969749577876866136751298699806140185791482016997238242061968986563706831.tar.gz",
          "sha256": "d491ea25c0225fdef41ad2296827915aca31298553cda95b16b1afd411064405"
        }
      ],
      "ecosystem": "cpan",
      "name": "LeanBridge-Runtime",
      "profile": "native-library-v1",
      "requires": [],
      "role": "runtime",
      "runtimeDelivery": "provided",
      "runtimeIdentity": "137cb2975ffded21021afe95f6e4cd7d33d6c5d9e605a9e0f28fd950136decdf",
      "target": "cpan",
      "version": "0.0020546188969749577876866136751298699806140185791482016997238242061968986563706831"
    },
    {
      "artifacts": [
        {
          "bytes": 80499,
          "path": "archives/LeanBridge-Subtypes-1.000.tar.gz",
          "sha256": "5f980fadf748f4ffb36d6b3afce9dd1c7361e65fd3f6f0ad84c92fbeca8cc3e9"
        }
      ],
      "ecosystem": "cpan",
      "name": "LeanBridge-Subtypes",
      "profile": "native-library-v1",
      "requires": [
        {
          "ecosystem": "cpan",
          "name": "LeanBridge-Runtime",
          "version": "0.0020546188969749577876866136751298699806140185791482016997238242061968986563706831"
        }
      ],
      "role": "component",
      "runtimeDelivery": "dependency",
      "runtimeIdentity": "137cb2975ffded21021afe95f6e4cd7d33d6c5d9e605a9e0f28fd950136decdf",
      "target": "cpan",
      "version": "1.000"
    }
  ],
  "profiles": [
    {
      "bindingIrSha256": "398c6ce8898c7419cc3c2e1b6788c76e9f340e8930e6a4cb094ed9af09d29465",
      "id": "native-library-v1",
      "runtimeIdentity": "137cb2975ffded21021afe95f6e4cd7d33d6c5d9e605a9e0f28fd950136decdf"
    }
  ],
  "schemaVersion": 1,
  "source": {
    "treeSha256": "a845f3e7c873c71a65205532fa99662ff82d68dd44d5b2fda9a390df823f930d"
  }
}
