{
  "component": {
    "id": "inheritedcheckedrecords@1.0.0",
    "name": "inheritedcheckedrecords",
    "version": "1.0.0"
  },
  "kind": "lean-bridge-package-set-receipt",
  "packages": [
    {
      "artifacts": [
        {
          "bytes": 129855,
          "path": "archives/LeanBridge-InheritedCheckedRecords-1.000.tar.gz",
          "sha256": "e9ab0efd722651d07c4b2cec58437d24df500bbd11f20547a5010e6838f61247"
        }
      ],
      "ecosystem": "cpan",
      "name": "LeanBridge-InheritedCheckedRecords",
      "profile": "native-library-v1",
      "requires": [
        {
          "ecosystem": "cpan",
          "name": "LeanBridge-Runtime",
          "version": "0.0020130180835253351074425099676719723942806298898514237203907626409680523998624031"
        }
      ],
      "role": "component",
      "runtimeDelivery": "dependency",
      "runtimeIdentity": "4b5a7fdf0cb11d4bb429181cfd50b330c5622ed8f5f5382a293955a439b595b5",
      "target": "cpan",
      "version": "1.000"
    },
    {
      "artifacts": [
        {
          "bytes": 51397607,
          "path": "archives/LeanBridge-Runtime-0.0020130180835253351074425099676719723942806298898514237203907626409680523998624031.tar.gz",
          "sha256": "c228af9110ba0b81d73a1fdf58d4435a68ab6c6ab0913382435ce0a2ee22de80"
        }
      ],
      "ecosystem": "cpan",
      "name": "LeanBridge-Runtime",
      "profile": "native-library-v1",
      "requires": [],
      "role": "runtime",
      "runtimeDelivery": "provided",
      "runtimeIdentity": "4b5a7fdf0cb11d4bb429181cfd50b330c5622ed8f5f5382a293955a439b595b5",
      "target": "cpan",
      "version": "0.0020130180835253351074425099676719723942806298898514237203907626409680523998624031"
    }
  ],
  "profiles": [
    {
      "bindingIrSha256": "705feaf165468944fe544a4cface435688c6f251ec4305fa827d5ce94844d7c4",
      "id": "native-library-v1",
      "runtimeIdentity": "4b5a7fdf0cb11d4bb429181cfd50b330c5622ed8f5f5382a293955a439b595b5"
    }
  ],
  "schemaVersion": 1,
  "source": {
    "treeSha256": "c3f9e758baac44c2046dd561dc3967377ff677e96cd74fcbc413dbf9e2703470"
  }
}
